{
  "case_id": "FHP-SYNTH-002",
  "synthetic_only": true,
  "person": {
    "display_name": "Maya Chen (fictional)",
    "life_direction": "Rebuild a financially sustainable path toward accessible remote coordination or documentation work while protecting recovery and daily stability."
  },
  "audience": "Future governed Stage 3 retest reviewers",
  "real_question": "What bounded preparation and observation may proceed now, what remains unverified, and which decisions belong to medical, occupational-therapy, vocational-rehabilitation, benefits, or client authority?",
  "requested_action": "Create a review-only pathway and capacity context without converting hopes, observations, or possible services into confirmed work capacity or approvals.",
  "authorized_source_ids": [
    "S1",
    "S2",
    "S3",
    "S4",
    "S5",
    "S6",
    "S7"
  ],
  "exclusions": [
    "No medical, work-capacity, eligibility, benefits, equipment, funding, or employment conclusion.",
    "No real personal records or identifying information.",
    "No external distribution, endorsement, acceptance-test claim, or operational approval."
  ]
}
